{
  "schema_version": "ai-platform.external-knowledge-slice-manifest.v1",
  "slice_id": "KCON-20",
  "issue_number": 1311,
  "summary": "Governed Knowledge connection application, routes, credentials, audit, and bootstrap candidate",
  "atomic_case_ids": [
    "KAC-FR-KCON-001",
    "KAC-FR-KCON-002",
    "KAC-FR-KCON-003",
    "KAC-FR-KCON-004",
    "KAC-FR-KCON-005",
    "KAC-FR-KCON-006",
    "KAC-FR-KCON-007",
    "KAC-FR-KCON-008",
    "KAC-FR-KCON-017",
    "KAC-FR-KCON-018",
    "KAC-FR-KCON-019",
    "KAC-FR-KCON-020",
    "KAC-FR-KCON-021",
    "KAC-FR-KCON-022",
    "KAC-FR-KCON-023",
    "KAC-FR-KCON-024",
    "KAC-FR-KCON-025",
    "KAC-FR-KCON-026",
    "KAC-FR-KCON-027",
    "KAC-FR-KCON-028",
    "KAC-FR-KCON-029",
    "KAC-FR-KCON-030",
    "KAC-FR-KCON-031",
    "KAC-FR-KCON-032",
    "KAC-FR-KCON-033",
    "KAC-FR-KCON-034",
    "KAC-FR-KCON-036",
    "KAC-FR-KCON-037",
    "KAC-FR-KCON-038",
    "KAC-FR-KCON-039",
    "KAC-FR-KCON-040",
    "KAC-FR-KCON-041",
    "KAC-FR-KSRC-041"
  ],
  "changed_paths": [
    "app/bootstrap/knowledge.py",
    "app/knowledge/application/__init__.py",
    "app/knowledge/application/control_plane.py",
    "app/knowledge/infrastructure/credential_vault.py",
    "app/knowledge/transport/__init__.py",
    "app/knowledge/transport/admin.py",
    "app/main.py",
    "app/platform/audit.py",
    "app/platform/credentials/__init__.py",
    "app/platform/credentials/vault.py",
    "app/settings.py",
    "docs/product/external-knowledge/manifests/KCON-20.json",
    "tests/test_knowledge_application.py"
  ],
  "evidence_layers": ["source", "unit"]
}
