{
  "schema_version": "ai-platform.external-knowledge-slice-manifest.v1",
  "slice_id": "KPROF-28",
  "issue_number": 1311,
  "summary": "Agent revision Knowledge fields and redacted public capability projection candidate",
  "atomic_case_ids": [
    "KAC-FR-KAGT-001",
    "KAC-FR-KAGT-002"
  ],
  "changed_paths": [
    "app/agent_apps/api.py",
    "app/agent_apps/authority.py",
    "app/knowledge/api.py",
    "app/knowledge/application/agent_profile_authorization.py",
    "app/models.py",
    "app/validation.py",
    "app/worker_main.py",
    "docs/product/external-knowledge/manifests/KPROF-28.json",
    "frontend/web/src/services/api/__tests__/agentProfile.test.ts",
    "frontend/web/src/types/agentProfile.ts",
    "frontend/web/src/types/index.ts",
    "tests/test_agent_profile_lifecycle.py",
    "tests/test_agent_profiles.py",
    "tests/test_repositories.py"
  ],
  "evidence_layers": ["source", "unit"]
}
