{
  "schema_version": "ai-platform.external-knowledge-slice-manifest.v1",
  "slice_id": "KSNAP-35",
  "issue_number": 1311,
  "summary": "Atomic Conversation Run and immutable Knowledge Snapshot admission",
  "atomic_case_ids": [
    "KAC-FR-KADM-018",
    "KAC-FR-KADM-019",
    "KAC-FR-KADM-020",
    "KAC-FR-KADM-021",
    "KAC-FR-KADM-022",
    "KAC-FR-KADM-023",
    "KAC-FR-KADM-024",
    "KAC-FR-KADM-025",
    "KAC-FR-KADM-026"
  ],
  "changed_paths": [
    "app/agent_profile_execution_validation.py",
    "app/conversations/api.py",
    "app/conversations/application/__init__.py",
    "app/conversations/application/run_admission.py",
    "app/knowledge/application/run_admission.py",
    "app/routes/chat.py",
    "app/routes/runs.py",
    "docs/product/external-knowledge/manifests/KSNAP-35.json",
    "tests/test_chat_routes.py",
    "tests/test_conversation_run_admission.py",
    "tests/test_run_control_routes.py",
    "tests/test_run_knowledge_admission.py"
  ],
  "evidence_layers": ["source", "unit", "integration"]
}
